{
  "$schema": "https://fluidsbench.org/schemas/releases/result-claim.schema.json",
  "schema_version": "1.0",
  "claim_id": "prototype-dev-2026-09-08-9a4220baccc1/windsorml/default/windsorml-ab-upt",
  "release": {
    "id": "prototype-dev-2026-09-08-9a4220baccc1",
    "status": "prototype_dummy_data",
    "published_at": "2026-09-09T07:15:01Z",
    "archive_url": null,
    "release_view_url": null
  },
  "result": {
    "submission_id": "windsorml-ab-upt",
    "result_revision": {
      "series_id": "windsorml-ab-upt",
      "version": 1,
      "supersedes": null,
      "change_summary": null,
      "is_latest": true,
      "latest_submission_id": "windsorml-ab-upt",
      "version_count": 1
    },
    "model": "AB-UPT",
    "dataset": "WindsorML",
    "dataset_id": "windsorml",
    "split": "Default",
    "split_id": "default",
    "submission_schema_version": "1.0"
  },
  "ranking": {
    "metric_id": "overall_score",
    "value": 82.6225,
    "ranked_value": 82.6,
    "display_value": "82.6",
    "unit": "",
    "direction": "higher",
    "decimal_places": 1,
    "rounding": "decimal_half_up",
    "method": "competition",
    "rank": 2,
    "ranked_result_count": 10,
    "tied": false,
    "tie_count": 1
  },
  "eligibility": {
    "academic_citation": false,
    "promotion": false,
    "reason_code": "prototype_dummy_data",
    "reason": "Illustrative prototype data are not eligible for academic leaderboard claims or promotion."
  },
  "result_permalink": null,
  "claim_record_url": null,
  "bindings": {
    "result": {
      "feed_file": "leaderboard/all.json",
      "feed_sha256": "9a4220baccc1fc7b24530c33b3e536397cd4d3f1c1c0371f8828e3ea07d7e6e8",
      "row_index": 39
    },
    "source_submission": {
      "path": "submissions/windsorml/windsorml-ab-upt/submission.json",
      "sha256": "919e76df71f7e83477c963f18218734293b01c06e7ab8cc762b2f6c6a7ec91ad"
    },
    "evaluation_evidence": {
      "path": "submissions/windsorml/windsorml-ab-upt/evaluation-evidence.json",
      "sha256": "05455ea0df42599d4ee690e7edea2c8bdd1653f5e85c22c5dfa76d3c832a5d96"
    },
    "profile_index": {
      "path": "submissions/windsorml/windsorml-ab-upt/profiles/index.json",
      "sha256": "4db1e8cc387280a2f3e2873ae1c6f2814a3ef2b41fbf34a08b8c68c96ead9697"
    }
  }
}
