{
  "$schema": "https://fluidsbench.org/schemas/releases/result-claim.schema.json",
  "schema_version": "1.0",
  "claim_id": "prototype-dev-2026-09-02-1792c6553473/windsorml/default/windsorml-oformer",
  "release": {
    "id": "prototype-dev-2026-09-02-1792c6553473",
    "status": "prototype_dummy_data",
    "published_at": "2026-09-05T06:53:29Z",
    "archive_url": null,
    "release_view_url": null
  },
  "result": {
    "submission_id": "windsorml-oformer",
    "result_revision": {
      "series_id": "windsorml-oformer",
      "version": 1,
      "supersedes": null,
      "change_summary": null,
      "is_latest": true,
      "latest_submission_id": "windsorml-oformer",
      "version_count": 1
    },
    "model": "OFormer",
    "dataset": "WindsorML",
    "dataset_id": "windsorml",
    "split": "Default",
    "split_id": "default",
    "submission_schema_version": "1.0"
  },
  "ranking": {
    "metric_id": "overall_score",
    "value": 78.91166666666666,
    "ranked_value": 78.9,
    "display_value": "78.9",
    "unit": "",
    "direction": "higher",
    "decimal_places": 1,
    "rounding": "decimal_half_up",
    "method": "competition",
    "rank": 4,
    "ranked_result_count": 10,
    "tied": false,
    "tie_count": 1
  },
  "eligibility": {
    "academic_citation": false,
    "promotion": false,
    "reason_code": "prototype_dummy_data",
    "reason": "Illustrative prototype data are not eligible for academic leaderboard claims or promotion."
  },
  "result_permalink": null,
  "claim_record_url": null,
  "bindings": {
    "result": {
      "feed_file": "leaderboard/all.json",
      "feed_sha256": "1792c65534735d72e138fd0646085918f857e8481cac42e5cc3305ea5c5a54f3",
      "row_index": 34
    },
    "source_submission": {
      "path": "submissions/windsorml/windsorml-oformer/submission.json",
      "sha256": "529f8c9c3fe4da179a43fcfc6f23073e97a9d135476b73074389eef07b149857"
    },
    "evaluation_evidence": {
      "path": "submissions/windsorml/windsorml-oformer/evaluation-evidence.json",
      "sha256": "a41b360ffeff337698e31623f02eaa88ec5dd033fc9c9467b82a9ffb3ad6e9bf"
    },
    "profile_index": {
      "path": "submissions/windsorml/windsorml-oformer/profiles/index.json",
      "sha256": "15180c818829865f36c6abee46f4a962ba62618cf7643ec7f6cc8d2941dbd188"
    }
  }
}
