{
  "$schema": "https://fluidsbench.org/schemas/releases/result-claim.schema.json",
  "schema_version": "1.0",
  "claim_id": "prototype-dev-2026-10-26-c764c61605c3/vki-ls59/train_125/vkils59-prototype-train-125",
  "release": {
    "id": "prototype-dev-2026-10-26-c764c61605c3",
    "status": "prototype_dummy_data",
    "published_at": "2026-10-28T14:46:11Z",
    "archive_url": null,
    "release_view_url": null
  },
  "result": {
    "submission_id": "vkils59-prototype-train-125",
    "result_revision": {
      "series_id": "vkils59-prototype-train-125",
      "version": 1,
      "supersedes": null,
      "change_summary": null,
      "is_latest": true,
      "latest_submission_id": "vkils59-prototype-train-125",
      "version_count": 1
    },
    "model": "Transolver",
    "dataset": "VKI-LS59",
    "dataset_id": "vki-ls59",
    "split": "train_125",
    "split_id": "train_125",
    "submission_schema_version": "1.0"
  },
  "ranking": {
    "metric_id": "overall_score",
    "value": 95.41975,
    "ranked_value": 95.4,
    "display_value": "95.4",
    "unit": "",
    "direction": "higher",
    "decimal_places": 1,
    "rounding": "decimal_half_up",
    "method": "competition",
    "rank": 1,
    "ranked_result_count": 1,
    "tied": false,
    "tie_count": 1
  },
  "eligibility": {
    "academic_citation": false,
    "promotion": false,
    "reason_code": "prototype_dummy_data",
    "reason": "Illustrative prototype data are not eligible for academic leaderboard claims or promotion."
  },
  "result_permalink": null,
  "claim_record_url": null,
  "bindings": {
    "result": {
      "feed_file": "leaderboard/all.json",
      "feed_sha256": "c764c61605c3af59bcb19d4ab6149886efc19a09b6944d2985f0895792cff2a5",
      "row_index": 45
    },
    "source_submission": {
      "path": "submissions/vki-ls59/vkils59-prototype-train-125/submission.json",
      "sha256": "8b4091863c2e71c240676e40db6d21e1c63205154684a081f095375041ba5ed8"
    },
    "evaluation_evidence": {
      "path": "submissions/vki-ls59/vkils59-prototype-train-125/evaluation-evidence.json",
      "sha256": "0e9710f35cdc046308be57706fb390db44515537f850dcfa5e06d353e0742c97"
    },
    "profile_index": {
      "path": "submissions/vki-ls59/vkils59-prototype-train-125/profiles/index.json",
      "sha256": "152453f0ed5c9805b98bae02cc22ecd64ba454e40e81dc46e04e5a854e8732b9"
    }
  }
}
