{
  "$schema": "https://fluidsbench.org/schemas/releases/result-claim.schema.json",
  "schema_version": "1.0",
  "claim_id": "prototype-dev-2026-10-26-c764c61605c3/rotor37/train_500/rotor37-prototype-train-500",
  "release": {
    "id": "prototype-dev-2026-10-26-c764c61605c3",
    "status": "prototype_dummy_data",
    "published_at": "2026-10-28T14:46:11Z",
    "archive_url": null,
    "release_view_url": null
  },
  "result": {
    "submission_id": "rotor37-prototype-train-500",
    "result_revision": {
      "series_id": "rotor37-prototype-train-500",
      "version": 1,
      "supersedes": null,
      "change_summary": null,
      "is_latest": true,
      "latest_submission_id": "rotor37-prototype-train-500",
      "version_count": 1
    },
    "model": "MeshGraphNets",
    "dataset": "Rotor37",
    "dataset_id": "rotor37",
    "split": "train_500",
    "split_id": "train_500",
    "submission_schema_version": "1.0"
  },
  "ranking": {
    "metric_id": "overall_score",
    "value": 97.65016666666665,
    "ranked_value": 97.7,
    "display_value": "97.7",
    "unit": "",
    "direction": "higher",
    "decimal_places": 1,
    "rounding": "decimal_half_up",
    "method": "competition",
    "rank": 1,
    "ranked_result_count": 1,
    "tied": false,
    "tie_count": 1
  },
  "eligibility": {
    "academic_citation": false,
    "promotion": false,
    "reason_code": "prototype_dummy_data",
    "reason": "Illustrative prototype data are not eligible for academic leaderboard claims or promotion."
  },
  "result_permalink": null,
  "claim_record_url": null,
  "bindings": {
    "result": {
      "feed_file": "leaderboard/all.json",
      "feed_sha256": "c764c61605c3af59bcb19d4ab6149886efc19a09b6944d2985f0895792cff2a5",
      "row_index": 57
    },
    "source_submission": {
      "path": "submissions/rotor37/rotor37-prototype-train-500/submission.json",
      "sha256": "e58433bc7b12c7f5c86173f99979bc1eb19a065aa3ca250d6447ef1285e7b616"
    },
    "evaluation_evidence": {
      "path": "submissions/rotor37/rotor37-prototype-train-500/evaluation-evidence.json",
      "sha256": "ca994b12a8830b1e4d5ddbce40200652a2791f4f096d2cd14515aedada598fad"
    },
    "profile_index": {
      "path": "submissions/rotor37/rotor37-prototype-train-500/profiles/index.json",
      "sha256": "e8793f5cc2b2191be4f68c607233854b65e41886aa61fd02cc00f6084d5e2911"
    }
  }
}
