{
  "$schema": "https://fluidsbench.org/schemas/releases/result-claim.schema.json",
  "schema_version": "1.0",
  "claim_id": "prototype-dev-2026-10-26-c764c61605c3/airfrans/reynolds_extrapolation/airfrans-graphsage-full",
  "release": {
    "id": "prototype-dev-2026-10-26-c764c61605c3",
    "status": "prototype_dummy_data",
    "published_at": "2026-10-28T14:46:11Z",
    "archive_url": null,
    "release_view_url": null
  },
  "result": {
    "submission_id": "airfrans-graphsage-full",
    "result_revision": {
      "series_id": "airfrans-graphsage-full",
      "version": 1,
      "supersedes": null,
      "change_summary": null,
      "is_latest": true,
      "latest_submission_id": "airfrans-graphsage-full",
      "version_count": 1
    },
    "model": "GraphSAGE",
    "dataset": "AirfRANS",
    "dataset_id": "airfrans",
    "split": "Reynolds extrapolation",
    "split_id": "reynolds_extrapolation",
    "submission_schema_version": "1.0"
  },
  "ranking": {
    "metric_id": "overall_score",
    "value": 62.611666666666665,
    "ranked_value": 62.6,
    "display_value": "62.6",
    "unit": "",
    "direction": "higher",
    "decimal_places": 1,
    "rounding": "decimal_half_up",
    "method": "competition",
    "rank": 1,
    "ranked_result_count": 1,
    "tied": false,
    "tie_count": 1
  },
  "eligibility": {
    "academic_citation": false,
    "promotion": false,
    "reason_code": "prototype_dummy_data",
    "reason": "Illustrative prototype data are not eligible for academic leaderboard claims or promotion."
  },
  "result_permalink": null,
  "claim_record_url": null,
  "bindings": {
    "result": {
      "feed_file": "leaderboard/all.json",
      "feed_sha256": "c764c61605c3af59bcb19d4ab6149886efc19a09b6944d2985f0895792cff2a5",
      "row_index": 3
    },
    "source_submission": {
      "path": "submissions/airfrans/airfrans-graphsage-full/submission.json",
      "sha256": "9a8bbb1e4db53167e00ec4d0a83f7d5ccbece8021f8a71eb2e5258475a3d90b1"
    },
    "evaluation_evidence": {
      "path": "submissions/airfrans/airfrans-graphsage-full/evaluation-evidence.json",
      "sha256": "d97e845d01ec260c6ba4592e186ed6ac8d0ee4bb4f17909105a691cc3a870481"
    },
    "profile_index": {
      "path": "submissions/airfrans/airfrans-graphsage-full/profiles/index.json",
      "sha256": "ed1923a5c93d3d03d7756231f52d151dff88db066ecb26b29c56ea8423717b50"
    }
  }
}
