{
  "$schema": "https://fluidsbench.org/schemas/releases/result-claim.schema.json",
  "schema_version": "1.0",
  "claim_id": "prototype-dev-2026-07-15-071e9792fc3d/drivaerml/low_drag/drivaerml-pointnet",
  "release": {
    "id": "prototype-dev-2026-07-15-071e9792fc3d",
    "status": "prototype_dummy_data",
    "published_at": "2026-08-22T07:12:51Z",
    "archive_url": null,
    "release_view_url": null
  },
  "result": {
    "submission_id": "drivaerml-pointnet",
    "result_revision": {
      "series_id": "drivaerml-pointnet",
      "version": 1,
      "supersedes": null,
      "change_summary": null,
      "is_latest": true,
      "latest_submission_id": "drivaerml-pointnet",
      "version_count": 1
    },
    "model": "PointNet",
    "dataset": "DrivAerML",
    "dataset_id": "drivaerml",
    "split": "Low drag",
    "split_id": "low_drag",
    "submission_schema_version": "1.0"
  },
  "ranking": {
    "metric_id": "overall_score",
    "value": 10.08909522753,
    "ranked_value": 10.1,
    "display_value": "10.1",
    "unit": "",
    "direction": "higher",
    "decimal_places": 1,
    "rounding": "decimal_half_up",
    "method": "competition",
    "rank": 1,
    "ranked_result_count": 1,
    "tied": false,
    "tie_count": 1
  },
  "eligibility": {
    "academic_citation": false,
    "promotion": false,
    "reason_code": "prototype_dummy_data",
    "reason": "Illustrative prototype data are not eligible for academic leaderboard claims or promotion."
  },
  "result_permalink": null,
  "claim_record_url": null,
  "bindings": {
    "result": {
      "feed_file": "leaderboard/all.json",
      "feed_sha256": "071e9792fc3d764f85f168826b59b4600ad4cb8e86ecd1c1fa2e08100065a333",
      "row_index": 20
    },
    "source_submission": {
      "path": "submissions/drivaerml/drivaerml-pointnet/submission.json",
      "sha256": "6664c9555558fc0aebaeace6d934116e787941fc73d780fbed5df5c807b178eb"
    },
    "evaluation_evidence": {
      "path": "submissions/drivaerml/drivaerml-pointnet/evaluation-evidence.json",
      "sha256": "81935b6a453332a2ca933026878079fec9abb86771d888c715b50a5a9438daf3"
    },
    "profile_index": {
      "path": "submissions/drivaerml/drivaerml-pointnet/profiles/index.json",
      "sha256": "440c2ac1d8d3cf91ab168b6b21cd90d7692cd1eabd58fd276b646b846827b2a2"
    }
  }
}
