{
  "$schema": "https://fluidsbench.org/schemas/releases/result-claim.schema.json",
  "schema_version": "1.0",
  "claim_id": "prototype-dev-2026-09-11-c28138b7f8c5/windsorml/default/windsorml-pointnet",
  "release": {
    "id": "prototype-dev-2026-09-11-c28138b7f8c5",
    "status": "prototype_dummy_data",
    "published_at": "2026-09-11T15:14:40Z",
    "archive_url": null,
    "release_view_url": null
  },
  "result": {
    "submission_id": "windsorml-pointnet",
    "result_revision": {
      "series_id": "windsorml-pointnet",
      "version": 1,
      "supersedes": null,
      "change_summary": null,
      "is_latest": true,
      "latest_submission_id": "windsorml-pointnet",
      "version_count": 1
    },
    "model": "PointNet",
    "dataset": "WindsorML",
    "dataset_id": "windsorml",
    "split": "Default",
    "split_id": "default",
    "submission_schema_version": "1.0"
  },
  "ranking": {
    "metric_id": "overall_score",
    "value": 36.78,
    "ranked_value": 36.8,
    "display_value": "36.8",
    "unit": "",
    "direction": "higher",
    "decimal_places": 1,
    "rounding": "decimal_half_up",
    "method": "competition",
    "rank": 10,
    "ranked_result_count": 10,
    "tied": false,
    "tie_count": 1
  },
  "eligibility": {
    "academic_citation": false,
    "promotion": false,
    "reason_code": "prototype_dummy_data",
    "reason": "Illustrative prototype data are not eligible for academic leaderboard claims or promotion."
  },
  "result_permalink": null,
  "claim_record_url": null,
  "bindings": {
    "result": {
      "feed_file": "leaderboard/all.json",
      "feed_sha256": "c28138b7f8c57dfc95c4ae0388ed96e7d80c60bc049e9e00f430d0a9386c6061",
      "row_index": 55
    },
    "source_submission": {
      "path": "submissions/windsorml/windsorml-pointnet/submission.json",
      "sha256": "0fa52a3d231c929f08bcfc90e0c7ed93d026f5b838ddd0f241b267076668f176"
    },
    "evaluation_evidence": {
      "path": "submissions/windsorml/windsorml-pointnet/evaluation-evidence.json",
      "sha256": "c65310bfae5d3ae7544975ee850ea28087b205091ed63cb367c3877bfb8a356f"
    },
    "profile_index": {
      "path": "submissions/windsorml/windsorml-pointnet/profiles/index.json",
      "sha256": "42d6464e5907adc5ebcedfe3bf9e40c64024a861c75798d1082c97ed14189add"
    }
  }
}
