{
  "$schema": "https://fluidsbench.org/schemas/releases/result-claim.schema.json",
  "schema_version": "1.0",
  "claim_id": "prototype-dev-2026-10-26-c764c61605c3/airfrans/aoa_extrapolation/airfrans-mlp-full",
  "release": {
    "id": "prototype-dev-2026-10-26-c764c61605c3",
    "status": "prototype_dummy_data",
    "published_at": "2026-10-28T14:46:11Z",
    "archive_url": null,
    "release_view_url": null
  },
  "result": {
    "submission_id": "airfrans-mlp-full",
    "result_revision": {
      "series_id": "airfrans-mlp-full",
      "version": 1,
      "supersedes": null,
      "change_summary": null,
      "is_latest": true,
      "latest_submission_id": "airfrans-mlp-full",
      "version_count": 1
    },
    "model": "MLP",
    "dataset": "AirfRANS",
    "dataset_id": "airfrans",
    "split": "AoA extrapolation",
    "split_id": "aoa_extrapolation",
    "submission_schema_version": "1.0"
  },
  "ranking": {
    "metric_id": "overall_score",
    "value": 61.67166666666667,
    "ranked_value": 61.7,
    "display_value": "61.7",
    "unit": "",
    "direction": "higher",
    "decimal_places": 1,
    "rounding": "decimal_half_up",
    "method": "competition",
    "rank": 1,
    "ranked_result_count": 2,
    "tied": false,
    "tie_count": 1
  },
  "eligibility": {
    "academic_citation": false,
    "promotion": false,
    "reason_code": "prototype_dummy_data",
    "reason": "Illustrative prototype data are not eligible for academic leaderboard claims or promotion."
  },
  "result_permalink": null,
  "claim_record_url": null,
  "bindings": {
    "result": {
      "feed_file": "leaderboard/all.json",
      "feed_sha256": "c764c61605c3af59bcb19d4ab6149886efc19a09b6944d2985f0895792cff2a5",
      "row_index": 4
    },
    "source_submission": {
      "path": "submissions/airfrans/airfrans-mlp-full/submission.json",
      "sha256": "a977db946eb56b5723bbb6152f6d4b43f167c06a9994e5f3f2ea65be563c730a"
    },
    "evaluation_evidence": {
      "path": "submissions/airfrans/airfrans-mlp-full/evaluation-evidence.json",
      "sha256": "0805b7c9aa2c0ee4dc2ccee7c6a0f5926f1250c8899727a2376e36563b2d35ee"
    },
    "profile_index": {
      "path": "submissions/airfrans/airfrans-mlp-full/profiles/index.json",
      "sha256": "741e3d20b4de92ea4694b3faa59934f22c6394c4997028b2f4b4155db63d655f"
    }
  }
}
